{
 "schema": "wakeel.knowledge-registry.v0.3",
 "schema_uri": "schema/wakeel-registry.schema.json",
 "date": "2026-10-25",
 "status": "PLANNING_DRAFT_NOT_IMPLEMENTATION",
 "supersedes": "wakeel.knowledge-registry.v0.2",
 "revision": "r2-review-applied",
 "scope": "All major AI branches; open-ended not final exhaustive universal ontology",
 "fundamental_rule": "Every topic independently accessible; prerequisites inform explanations, never gate access.",
 "single_source_of_truth": {
  "rule_ar": "العلاقات تُخزَّن في relations وحدها. لا تُنسخ داخل الموضوع. ما يظهر في صفحة الموضوع مشتق عند القراءة.",
  "reason_ar": "v0.1 كان يخزن كل علاقة مرتين (prerequisites وrelated) بفردتين مختلفتين لاسم النوع، فكان الانحراف الصامت ممكناً.",
  "derived_at_read_time": [
   "prerequisites(topic)",
   "related(topic)",
   "topic_count(domain)",
   "coverage_counts"
  ]
 },
 "domain_groups": [
  {
   "id": "GRP-FOUND",
   "title_ar": "الأسس",
   "title_en": "Foundations",
   "domain_ids": [
    "FND",
    "MAT",
    "DAT",
    "HIS"
   ]
  },
  {
   "id": "GRP-METHODS",
   "title_ar": "مناهج الذكاء",
   "title_en": "AI Methods",
   "domain_ids": [
    "SYM",
    "ML",
    "DLN",
    "RLC"
   ]
  },
  {
   "id": "GRP-MODELS",
   "title_ar": "النماذج والتوليد",
   "title_en": "Models and Generation",
   "domain_ids": [
    "NLP",
    "LLM",
    "TRN",
    "INF",
    "CVG",
    "AUD",
    "MMU"
   ]
  },
  {
   "id": "GRP-SYSTEMS",
   "title_ar": "الأنظمة والفعل",
   "title_en": "Systems and Action",
   "domain_ids": [
    "AGT",
    "ROB",
    "SYS"
   ]
  },
  {
   "id": "GRP-QUALITY",
   "title_ar": "الجودة والبحث",
   "title_en": "Quality, Society and Research",
   "domain_ids": [
    "EVA",
    "HUM",
    "RES",
    "APP"
   ]
  }
 ],
 "domains": [
  {
   "id": "FND",
   "group_id": "GRP-FOUND",
   "title_ar": "المفاهيم التأسيسية والحوسبة",
   "title_en": "Foundations and Computing"
  },
  {
   "id": "MAT",
   "group_id": "GRP-FOUND",
   "title_ar": "الرياضيات والاحتمال والتحسين",
   "title_en": "Mathematics and Optimization"
  },
  {
   "id": "DAT",
   "group_id": "GRP-FOUND",
   "title_ar": "البيانات والقياس والمنهج التجريبي",
   "title_en": "Data and Experimental Practice"
  },
  {
   "id": "SYM",
   "group_id": "GRP-METHODS",
   "title_ar": "الذكاء الرمزي والبحث وتمثيل المعرفة",
   "title_en": "Symbolic AI, Search and Reasoning"
  },
  {
   "id": "HIS",
   "group_id": "GRP-FOUND",
   "title_ar": "تاريخ الذكاء الاصطناعي وتطور أفكاره",
   "title_en": "History of AI and Paradigms"
  },
  {
   "id": "ML",
   "group_id": "GRP-METHODS",
   "title_ar": "التعلم الآلي الكلاسيكي",
   "title_en": "Classical Machine Learning"
  },
  {
   "id": "DLN",
   "group_id": "GRP-METHODS",
   "title_ar": "الشبكات العصبية والتعلم العميق",
   "title_en": "Neural Networks and Deep Learning"
  },
  {
   "id": "NLP",
   "group_id": "GRP-MODELS",
   "title_ar": "اللغة والنصوص والتمثيل اللغوي",
   "title_en": "Natural Language Processing"
  },
  {
   "id": "LLM",
   "group_id": "GRP-MODELS",
   "title_ar": "النمذجة اللغوية وبناء النماذج",
   "title_en": "Language Modeling and Architectures"
  },
  {
   "id": "TRN",
   "group_id": "GRP-MODELS",
   "title_ar": "التدريب والضبط اللاحق والمحاذاة",
   "title_en": "Training and Post-Training"
  },
  {
   "id": "INF",
   "group_id": "GRP-MODELS",
   "title_ar": "الاستدلال والتوليد وكفاءة التشغيل",
   "title_en": "Inference and Generation Efficiency"
  },
  {
   "id": "AGT",
   "group_id": "GRP-SYSTEMS",
   "title_ar": "الاسترجاع والأدوات والوكلاء",
   "title_en": "Retrieval, Tools and Agents"
  },
  {
   "id": "CVG",
   "group_id": "GRP-MODELS",
   "title_ar": "الرؤية الحاسوبية وتوليد الصور",
   "title_en": "Computer Vision and Image Generation"
  },
  {
   "id": "AUD",
   "group_id": "GRP-MODELS",
   "title_ar": "الصوت والكلام",
   "title_en": "Speech and Audio AI"
  },
  {
   "id": "MMU",
   "group_id": "GRP-MODELS",
   "title_ar": "الذكاء متعدد الوسائط والفيديو",
   "title_en": "Multimodal and Video AI"
  },
  {
   "id": "RLC",
   "group_id": "GRP-METHODS",
   "title_ar": "التعلم المعزز والقرار والسببية",
   "title_en": "Reinforcement Learning, Decision and Causality"
  },
  {
   "id": "ROB",
   "group_id": "GRP-SYSTEMS",
   "title_ar": "الروبوتات والإدراك والتحكم",
   "title_en": "Robotics and Embodied AI"
  },
  {
   "id": "SYS",
   "group_id": "GRP-SYSTEMS",
   "title_ar": "هندسة النظم والعتاد والنشر",
   "title_en": "AI Engineering, Systems and Hardware"
  },
  {
   "id": "EVA",
   "group_id": "GRP-QUALITY",
   "title_ar": "التقييم والموثوقية والأمن",
   "title_en": "Evaluation, Reliability and Security"
  },
  {
   "id": "HUM",
   "group_id": "GRP-QUALITY",
   "title_ar": "الإنسان والمجتمع والحوكمة",
   "title_en": "Human Factors, Society and Governance"
  },
  {
   "id": "RES",
   "group_id": "GRP-QUALITY",
   "title_ar": "منهج البحث العلمي والجبهات الجديدة",
   "title_en": "Scientific Research and Frontiers"
  },
  {
   "id": "APP",
   "group_id": "GRP-QUALITY",
   "title_ar": "التطبيقات والحلول القطاعية",
   "title_en": "Applications and Domain Practice"
  }
 ],
 "relation_types": {
  "motivates": {
   "title_ar": "يحرّك",
   "direction_ar": "من المشكلة/الحاجة إلى السؤال الذي تُنتجه",
   "symmetric": false,
   "is_dependency": false,
   "example_ar": "الحاجة إلى التعامل مع اللغة ← التعلم من أمثلة ← النمذجة اللغوية"
  },
  "reveals_limit": {
   "title_ar": "يكشف حداً",
   "direction_ar": "من حل إلى السؤال الذي يظهر عند فشله",
   "symmetric": false,
   "is_dependency": false,
   "example_ar": "Bigram ← محدودية السياق ← نموذج يستخدم سياقاً أطول"
  },
  "hard_implementation": {
   "title_ar": "شرط تنفيذ",
   "direction_ar": "من المتطلب إلى ما يتطلبه عند التنفيذ فقط",
   "symmetric": false,
   "is_dependency": true,
   "example_ar": "المشتقات ← الانتشار العكسي عند برمجته عددياً"
  },
  "just_in_time": {
   "title_ar": "تمهيد موجز",
   "direction_ar": "من المفهوم المساعد إلى الموضوع الذي يحتاجه",
   "symmetric": false,
   "is_dependency": true,
   "example_ar": "معرّف الرمز ← نشاط التضمين"
  },
  "contrast": {
   "title_ar": "تقابل",
   "direction_ar": "من نهج إلى نهج بديل يصلح للمقارنة",
   "symmetric": true,
   "is_dependency": false,
   "example_ar": "القواعد المكتوبة ↔ التعلم من الأمثلة"
  },
  "related": {
   "title_ar": "مرتبط",
   "direction_ar": "ارتباط معرفي بلا ترتيب مفروض",
   "symmetric": true,
   "is_dependency": false,
   "example_ar": "التحليل الصرفي ↔ التقطيع تحت الكلمة"
  },
  "historical_context": {
   "title_ar": "سياق تاريخي",
   "direction_ar": "من اللاحق إلى محطته التاريخية",
   "symmetric": false,
   "is_dependency": false,
   "example_ar": "Transformer ← مراحل تطور الانتباه"
  },
  "explains": {
   "title_ar": "يفسّر",
   "direction_ar": "من الأعمق تفسيراً إلى الظاهرة التي يفسرها",
   "symmetric": false,
   "is_dependency": false,
   "example_ar": "الاحتمالات ← توزيع التنبؤ والتوليد"
  },
  "clarifies": {
   "title_ar": "يوضّح تمييزاً",
   "direction_ar": "من المفهوم إلى المفاهيم المتشابهة التي يميّزها",
   "symmetric": true,
   "is_dependency": false,
   "example_ar": "البرنامج ↔ النموذج ↔ البيانات"
  },
  "specializes": {
   "title_ar": "تخصيص",
   "direction_ar": "من الحالة الخاصة إلى المفهوم العام",
   "symmetric": false,
   "is_dependency": false,
   "example_ar": "مثال عدائي ← اختبار المتانة"
  }
 },
 "relations": [
  {
   "source": "FND-002",
   "target": "FND-003",
   "type": "motivates"
  },
  {
   "source": "FND-003",
   "target": "FND-004",
   "type": "clarifies"
  },
  {
   "source": "FND-004",
   "target": "FND-013",
   "type": "contrast"
  },
  {
   "source": "FND-008",
   "target": "DAT-006",
   "type": "hard_implementation"
  },
  {
   "source": "FND-008",
   "target": "NLP-001",
   "type": "just_in_time"
  },
  {
   "source": "DAT-001",
   "target": "ML-001",
   "type": "just_in_time"
  },
  {
   "source": "DAT-001",
   "target": "LLM-001",
   "type": "just_in_time"
  },
  {
   "source": "DAT-007",
   "target": "NLP-014",
   "type": "just_in_time"
  },
  {
   "source": "DAT-008",
   "target": "ML-015",
   "type": "hard_implementation"
  },
  {
   "source": "DAT-008",
   "target": "TRN-006",
   "type": "hard_implementation"
  },
  {
   "source": "DAT-009",
   "target": "EVA-003",
   "type": "just_in_time"
  },
  {
   "source": "FND-002",
   "target": "NLP-001",
   "type": "motivates"
  },
  {
   "source": "FND-013",
   "target": "ML-001",
   "type": "motivates"
  },
  {
   "source": "ML-001",
   "target": "LLM-001",
   "type": "motivates"
  },
  {
   "source": "LLM-001",
   "target": "LLM-002",
   "type": "motivates"
  },
  {
   "source": "LLM-002",
   "target": "LLM-003",
   "type": "motivates"
  },
  {
   "source": "LLM-003",
   "target": "LLM-004",
   "type": "explains"
  },
  {
   "source": "MAT-010",
   "target": "LLM-005",
   "type": "hard_implementation"
  },
  {
   "source": "MAT-011",
   "target": "LLM-007",
   "type": "just_in_time"
  },
  {
   "source": "DAT-006",
   "target": "NLP-002",
   "type": "hard_implementation"
  },
  {
   "source": "NLP-002",
   "target": "NLP-003",
   "type": "just_in_time"
  },
  {
   "source": "NLP-003",
   "target": "NLP-004",
   "type": "explains"
  },
  {
   "source": "NLP-004",
   "target": "LLM-007",
   "type": "hard_implementation"
  },
  {
   "source": "NLP-005",
   "target": "NLP-006",
   "type": "just_in_time"
  },
  {
   "source": "NLP-006",
   "target": "NLP-008",
   "type": "related"
  },
  {
   "source": "NLP-004",
   "target": "NLP-009",
   "type": "hard_implementation"
  },
  {
   "source": "NLP-004",
   "target": "LLM-003",
   "type": "hard_implementation"
  },
  {
   "source": "MAT-017",
   "target": "LLM-008",
   "type": "hard_implementation"
  },
  {
   "source": "DLN-001",
   "target": "LLM-008",
   "type": "hard_implementation"
  },
  {
   "source": "LLM-007",
   "target": "LLM-008",
   "type": "contrast"
  },
  {
   "source": "LLM-008",
   "target": "LLM-010",
   "type": "reveals_limit"
  },
  {
   "source": "LLM-010",
   "target": "LLM-011",
   "type": "motivates"
  },
  {
   "source": "LLM-011",